{
  "name": "vault-capture-1on1",
  "version": 1,
  "summary": "Turn a 1:1 transcript, notes, or summary into a structured vault note with takeaways, quotes, action items, and related context.",
  "aliases": [
    "/vault-capture-1on1",
    "vault-capture-1on1"
  ],
  "risk_tier": "medium",
  "approval_classes": [
    "vault_write",
    "external_read"
  ],
  "inputs": [
    "participant name",
    "transcript or notes when capturing"
  ],
  "writes": [
    "Notes/1-1/",
    "org/people/",
    "Notes/Index.md",
    "harness/memory.md"
  ],
  "external_reads": [
    "Slack or direct transcript context when provided"
  ],
  "external_mutations": [],
  "approval_gates": [
    "vault_write: follow harness/policies/approvals.md",
    "external_read: follow harness/policies/approvals.md"
  ],
  "done_when": [
    "workflow scope is satisfied or explicitly blocked",
    "external evidence is labeled with source and retrieval status",
    "touched files are listed with paths",
    "approval gates are respected",
    "return contract is complete"
  ],
  "verification": [
    "verify changed Markdown/frontmatter where files were edited",
    "verify wikilinks where notes were created or changed",
    "verify external evidence is labeled and scoped"
  ],
  "return_contract": [
    "Done",
    "Evidence",
    "Open Items",
    "Next"
  ],
  "related_roles": [
    "operator"
  ]
}
