{
  "name": "seo-programmatic-quality-gate",
  "version": 1,
  "summary": "Block unsafe scaled SEO recommendations until samples, information gain, business purpose, uniqueness, evidence, and controls are verified.",
  "aliases": ["/seo-programmatic-quality-gate", "seo-programmatic-quality-gate", "programmatic SEO gate"],
  "risk_tier": "high",
  "approval_classes": ["read_only", "vault_write", "external_read"],
  "inputs": ["project/template family/page range/data source/markets/query evidence/business purpose/owners/launch-prune scope", "representative samples and approved audit/ecommerce/local/technical/schema/analytics evidence", "approved output path"],
  "writes": ["resolved context artifact", "review artifact", "Home review link when required"],
  "external_reads": ["approved provider, page, analytics, catalog, crawl, and first-party evidence"],
  "external_mutations": [],
  "approval_gates": ["external_read: ask before live provider, page, analytics, catalog, or crawl reads", "provider_data: paid or credentialed calls require approval", "vault_write: save only to resolved context", "external_mutation: generation, publishing, template, CMS, code, and production changes are out of scope"],
  "done_when": ["representative sample, template family, data source, page range, purpose, evidence, information gain, uniqueness, risk, owner, and recheck are explicit", "missing samples, facts, purpose, information gain, controls, or rollback block", "verdict is PASS, PASS_WITH_CONDITIONS, BLOCK, or DEFERRED", "no pages are generated or published", "seo-quality-gate passes or is explicitly deferred", "return contract is complete"],
  "verification": ["verify no scaled pages were generated or published", "verify blocked evidence and conditions are visible", "verify no template, CMS, code, or production mutation occurred", "verify changed artifact and review registration when applicable"],
  "return_contract": ["Done", "Evidence", "Open Items", "Next"],
  "related_roles": ["strategist", "writer", "developer", "wordpress-operator", "verifier"]
}
