{
  "name": "repurpose-content",
  "version": 1,
  "summary": "Turn an existing source artifact into derivative outputs while preserving evidence, context, and approval boundaries.",
  "aliases": [
    "/repurpose-content",
    "repurpose-content",
    "repurpose this",
    "turn this into social posts",
    "turn this into a newsletter"
  ],
  "risk_tier": "medium",
  "approval_classes": [
    "read_only",
    "vault_write",
    "external_read"
  ],
  "inputs": [
    "source artifact",
    "target channels",
    "client/project context",
    "audience",
    "desired action",
    "approval boundary"
  ],
  "writes": [
    "Clients/",
    "Projects/",
    "user-approved bundle path"
  ],
  "external_reads": [
    "source URLs",
    "current campaign pages",
    "public source inspection when approved"
  ],
  "external_mutations": [],
  "approval_gates": [
    "vault_write: follow harness/policies/approvals.md before editing vault files unless already authorized",
    "external_read: ask before reading external websites or sources",
    "external_mutation: out of scope; posting, sending, scheduling, or publishing requires a separate workflow"
  ],
  "done_when": [
    "source artifact is identified and inspected",
    "target channels and target skills are explicit",
    "derivative outputs are returned or saved to an approved path",
    "source map preserves evidence labels and caveats",
    "writing-quality-gate has passed or is explicitly deferred with reason",
    "return contract is complete"
  ],
  "verification": [
    "verify content-repurpose source map exists",
    "verify claim-check runs when material claims are reused or compressed",
    "verify derivative outputs do not strengthen unsupported claims",
    "verify changed Markdown/frontmatter if files are edited"
  ],
  "return_contract": [
    "Done",
    "Evidence",
    "Open Items",
    "Next"
  ],
  "related_roles": [
    "writer",
    "strategist",
    "verifier",
    "designer",
    "wordpress-operator"
  ]
}
