{
  "name": "vault-humanize",
  "version": 1,
  "summary": "Voice-calibrated editing — makes agent-drafted text sound like you wrote it, not like AI wrote it.",
  "aliases": [
    "/vault-humanize",
    "vault-humanize"
  ],
  "risk_tier": "low",
  "approval_classes": [
    "vault_write"
  ],
  "inputs": [
    "file path or note name"
  ],
  "writes": [
    "specified Markdown file"
  ],
  "external_reads": [],
  "external_mutations": [],
  "approval_gates": [
    "vault_write: follow harness/policies/approvals.md"
  ],
  "done_when": [
    "workflow scope is satisfied or explicitly blocked",
    "touched files are listed with paths",
    "approval gates are respected",
    "return contract is complete"
  ],
  "verification": [
    "verify changed Markdown/frontmatter where files were edited",
    "verify wikilinks where notes were created or changed",
    "run `.agents/scripts/charcount.ts` when character limits apply"
  ],
  "return_contract": [
    "Done",
    "Evidence",
    "Open Items",
    "Next"
  ],
  "related_roles": [
    "operator"
  ]
}
