{
  "name": "seo-quality-gate",
  "version": 1,
  "summary": "Evaluate an SEO artifact against the canonical discipline rubric without producing or mutating findings.",
  "aliases": [
    "/seo-quality-gate",
    "seo-quality-gate"
  ],
  "risk_tier": "medium",
  "approval_classes": [
    "read_only",
    "vault_write",
    "external_read"
  ],
  "inputs": [
    "SEO mode and scoped client/site/artifact context",
    "approved evidence or local tool target"
  ],
  "writes": [
    "scoped foundation, gate, plan, or evidence artifact"
  ],
  "external_reads": [
    "approved live pages, crawls, providers, or first-party sources"
  ],
  "external_mutations": [],
  "approval_gates": [
    "external_read: ask before live URLs, crawls, providers, or credentialed sources",
    "provider_data: paid or credentialed calls require approval",
    "vault_write: save only to resolved context and approved evidence paths",
    "external_mutation: CMS, code, analytics, provider, SEO, and production mutation is out of scope"
  ],
  "done_when": [
    "mode, scope, sources, labels, approvals, limitations, and handoffs are explicit",
    "missing, partial, capped, stale, blocked, or unavailable evidence is visible",
    "no unsupported performance or visibility guarantee is made",
    "return contract is complete"
  ],
  "verification": [
    "verify no secrets are written",
    "verify no unapproved external mutation occurred",
    "verify canonical output shape"
  ],
  "return_contract": [
    "Done",
    "Evidence",
    "Open Items",
    "Next"
  ],
  "related_roles": [
    "strategist",
    "developer",
    "verifier"
  ]
}
