{
  "name": "vault-self-review",
  "version": 1,
  "summary": "Draft a self-review from vault evidence, candidate review notes, and project outcomes for a target review cycle.",
  "aliases": [
    "/vault-self-review",
    "vault-self-review"
  ],
  "risk_tier": "medium",
  "approval_classes": [
    "vault_write"
  ],
  "inputs": [
    "review audience, person, or cycle"
  ],
  "writes": [
    "reviews/"
  ],
  "external_reads": [],
  "external_mutations": [],
  "approval_gates": [
    "vault_write: follow harness/policies/approvals.md"
  ],
  "done_when": [
    "workflow scope is satisfied or explicitly blocked",
    "touched files are listed with paths",
    "approval gates are respected",
    "return contract is complete"
  ],
  "verification": [
    "verify changed Markdown/frontmatter where files were edited",
    "verify wikilinks where notes were created or changed",
    "run `.agents/scripts/charcount.ts` when character limits apply"
  ],
  "return_contract": [
    "Done",
    "Evidence",
    "Open Items",
    "Next"
  ],
  "related_roles": [
    "operator"
  ]
}
